Condition Code,Stage,Rules,Class,Type,Number,Name,Description,Editable in Byte,Dynamic Description,Borrower Description,Document Provider,Responsibility,Category,Borrower/All Borrower,Dynamic Data,Data for Logic,Logic to Apply,Byte Filter
PROP601,PTD,Mortgage Type = Conv -or- VA -or- FHA -and- Lien Position = 1.  Exclude Bond loans,Processor III,PROP,601,,For Coventional loans using DU -and- FHA/VA loans: Proof of hazard insurance with coverage equal to 100% of the insurable value required. Coverage equal to the loan amount is acceptable if the loan amount is more than or equal to 80% of the insurable value. Maximum deductible of 5% or more if state required. Premiums renewing within 60 days of funding require proof of premium paid in full or pay through closing. Must state CMG as Mortgagee. For Conventional loans using LPA: Proof of hazard insurance with coverage equal to the greater of the UPB or 80% of the replacement cost. Maximum Deductible of 5%.or more if state required. Premiums renewing within 60 days of funding require proof of premium paid in full or pay through closing. Must state CMG as Mortgagee. ,Editable,,,INT,,,,,,Mortgage Type = Conv -or- VA -or- FHA -and- Lien Position = 1.  Exclude Bond loans,0
PROP603,PTD,"Mortgage Type = VA (Not IRRRL), Exclude New Construction, Lien Position = 1, Subject Property State = Alabama / Arkansas / Arizona / California / Connecticut / Delaware / Florida / Georgia / Hawaii / Iowa / Illinois / Indiana / Kansas / Kentucky / Louisiana / Massachusetts / Maryland / Mississippi / Missouri / North Carolina / Nebraska / New Jersey / New Mexico / Nevada / Ohio / Oklahoma / Pennsylvania / Rhode Island / South Carolina / Tennessee / Texas / Utah / Virginia / West Virginia / Washington, D.C.",UW,PROP,603,,VA Loans - Termite report and clearance when required.  Refer to Termite Infestation Probability Map and guidelines for requirements.,Editable,,,INT,,,,,,"Mortgage Type = VA (Not IRRRL), Exclude New Construction, Lien Position = 1, Subject Property State = Alabama / Arkansas / Arizona / California / Connecticut / Delaware / Florida / Georgia / Hawaii / Iowa / Illinois / Indiana / Kansas / Kentucky / Louisiana / Massachusetts / Maryland / Mississippi / Missouri / North Carolina / Nebraska / New Jersey / New Mexico / Nevada / Ohio / Oklahoma / Pennsylvania / Rhode Island / South Carolina / Tennessee / Texas / Utah / Virginia / West Virginia / Washington, D.C.",0
PROP616,Prior To Funding,"Mortgage Type = VA (Not IRRRL), Exclude New Construction, Lien Position = 1, Subject Property State = Alabama / Arkansas / Arizona / California / Connecticut / Delaware / Florida / Georgia / Hawaii / Iowa / Illinois / Indiana / Kansas / Kentucky / Louisiana / Massachusetts / Maryland / Mississippi / Missouri / North Carolina / Nebraska / New Jersey / New Mexico / Nevada / Ohio / Oklahoma / Pennsylvania / Rhode Island / South Carolina / Tennessee / Texas / Utah / Virginia / West Virginia / Washington, D.C.",PTF,PROP,616,,Borrowers to sign termite report and clearance.,Editable,,,INT,,,,,,"Mortgage Type = VA (Not IRRRL), Exclude New Construction, Lien Position = 1, Subject Property State = Alabama / Arkansas / Arizona / California / Connecticut / Delaware / Florida / Georgia / Hawaii / Iowa / Illinois / Indiana / Kansas / Kentucky / Louisiana / Massachusetts / Maryland / Mississippi / Missouri / North Carolina / Nebraska / New Jersey / New Mexico / Nevada / Ohio / Oklahoma / Pennsylvania / Rhode Island / South Carolina / Tennessee / Texas / Utah / Virginia / West Virginia / Washington, D.C.",0
PROP617,PTD,"Mortgage Type = VA (Exclude IRRRL), Lien Position = 1",UW,PROP,617,,VA Appraisal.,Editable,,,INT,,,,,,"Mortgage Type = VA (Exclude IRRRL), Lien Position = 1",Loan_MortgageType In List: VA
TITLE901,PTD,"Mortgage Type = Conv -or- VA -or- FHA, USDA, -and- Lien Position = 1",UW,TITLE,901,,"Preliminary Title with 12-month Chain of Title, Tax Certificate, and Plat Map / Survey or ALTA-9.",Editable,,,INT,,,,,,"Mortgage Type = Conv -or- VA -or- FHA, USDA, -and- Lien Position = 1",0
TITLE908,PTD,"Mortgage Type = Conv -or- VA -or- FHA, USDA, -and- Lien Position = 1",Processor III,TITLE,908,,Closing Protection Letter / Title's Errors & Omissions / Wire Instructions - CPL must be dated or effective through funding date all states.,Editable,,,INT,,,,,,"Mortgage Type = Conv -or- VA -or- FHA, USDA, -and- Lien Position = 1",0
